Creating fragment
[97;1m==================================================
[0m[34;1m                   JOTUNN
[0m[97;22ma simple quantum chemistry program in Julia
[0m[97;1m==================================================
[0m[33;1m
jSCF: a HF/DFT program
[0m
[32;1mSYSTEM
[0m========================= =================
         Number of atoms                1
        Molecule formula               He
                  Charge                0
       Spin multiplicity                1
           No. electrons                2
  No. unpaired electrons                0
       Nuclear repulsion       0.00000000
========================= =================
[97;1m
GEOMETRY (Cartesian coordinates in Å))
[0m-------------------------------------------------------------
  1   He       0.00000000       0.00000000       0.00000000
-------------------------------------------------------------

Integrals provided via GaussianBasis.jl library
Creating basis set object

Calculating 1-electron integrals
Time calculating 1-electron integrals: 0.236222096
Sparse integral calculation done.
Time calculating 2-electron integrals: 0.671304955
Providing guess: hcore

[32;1mCALCULATION SETTINGS
[0m========================= =================
                 WF type              RHF
               Basis set           sto-3g
     No. basis functions                1
                   Guess            hcore
         2-electron type         sparse4c
          Fock algorithm      loop-sparse
     S lowest eigenvalue           1.0000
              Levelshift            false
    Levelshift parameter           0.1000
  Lshift-turnoff thresh.           0.0100
                 Damping             true
       Damping parameter           0.4000
    Damp-turnoff thresh.           0.0100
                    DIIS             true
           DIIS vec size                5
        DIIS start iter.                4
========================= =================

Beginning SCF iterations
Iter         Energy          deltaE        RMS-DP        Max-DP  Lshift    Damp    DIIS  Max[F,P]
   1   -2.807783957[31m    -2.807783957[0m[32m   0.000000000[0m[32m   0.000000000[0m[39m   false[0m[33m    true[0m[39m   false[0m  0.0000
   2   -2.807783957[32m     0.000000000[0m[32m   0.000000000[0m[32m   0.000000000[0m[39m   false[0m[39m   false[0m[39m   false[0m  0.0000
Energy convergence threshold reached: 0.0 < 1.0e-8
[32;1m
                              SCF converged in 2 iterations! Hell yeah! 🎉

[0m┌──────────────────────┬────────────────━
│ Energy contributions │          E(Eh) │
├──────────────────────┼────────────────┤
│         Total energy │    -2.80778396 │
│    Nuclear repulsion │     0.00000000 │
│    Electronic energy │    -2.80778396 │
│    1-electron energy │    -3.86349690 │
│    2-electron energy │     1.05571294 │
│       Kinetic energy │     2.82352634 │
│     Potential energy │    -5.63131030 │
├──────────────────────┼────────────────┤
│         Virial ratio │     1.99442457 │
└──────────────────────┴────────────────┘
Time calculating SCF: 1.959536189


[33;1mMO Energies (closed-shell)
[0m
┌────┬──────┬──────────────┬──────────────━
│ MO │ Occ. │        E(Eh) │        E(eV) │
├────┼──────┼──────────────┼──────────────┤
│  1 │  2.0 │      -0.8760 │     -23.8382 │
└────┴──────┴──────────────┴──────────────┘
[33;1m
Mulliken Population Analysis (closed-shell)
[0m┌──────┬─────────┬────────────━
│ Atom │ Element │     Charge │
├──────┼─────────┼────────────┤
│    1 │      He │   0.000000 │
└──────┴─────────┴────────────┘

Sum of charges: 0.0000
[33;1m
Mayer bond orders
[0mThreshold: 0.01

[32;1mFINAL RESULTS
[0m====================== =================
      Final HF energy      -2.80778396
     Molecule formula               He
  Number of electrons                2
            Basis set           sto-3g
              WF type              RHF
       Fock algorithm      loop-sparse
       SCF iterations                2
====================== =================
Timings:
Time calculating 1-electron integrals: 0.236222096
Time calculating 2-electron integrals: 0.671304955
Time calculating SCF: 1.959536189
Time calculating grid: 0.0
Sum of all recorded times:2.8670632400000002
 26.401542 seconds (60.04 M allocations: 3.044 GiB, 6.48% gc time, 99.88% compilation time)
result_sp_norm: Dict{Any, Any}("time" => 5.585547629, "finaliter" => 2, "energy" => -2.807783956614194)
